{
  "answers": [
    {
      "answer_changing_information": [
        {
          "field": "sleep_clause_or_target_status",
          "if_true": "sleep move may become blocked or lower value",
          "needed": false
        }
      ],
      "benchmark_id": "vanilla_gsc_sleep_setup_disruption_001",
      "candidate_ranking": [
        {
          "action": "move_sleep_powder",
          "move_class": "sleep",
          "rank": 1,
          "reason": "sleep is legal into an unstatused target; sleep/setup disruption policy recreates the setup window",
          "score": 75
        },
        {
          "action": "move_sludge_bomb",
          "move_class": "attack",
          "rank": 2,
          "reason": "chip is live but does not recreate the setup window",
          "score": 20
        },
        {
          "action": "move_swords_dance",
          "move_class": "setup",
          "rank": 3,
          "reason": "setup follows a disrupted or threatened script; public punish can hit before setup converts",
          "score": -70
        }
      ],
      "candidate_scores": [
        {
          "class": "sleep",
          "move_id": "move_sleep_powder",
          "reasons": [
            "sleep is legal into an unstatused target",
            "sleep/setup disruption policy recreates the setup window"
          ],
          "score": 75
        },
        {
          "class": "attack",
          "move_id": "move_sludge_bomb",
          "reasons": [
            "chip is live but does not recreate the setup window"
          ],
          "score": 20
        },
        {
          "class": "setup",
          "move_id": "move_swords_dance",
          "reasons": [
            "setup follows a disrupted or threatened script",
            "public punish can hit before setup converts"
          ],
          "score": -70
        }
      ],
      "catastrophe_branches": [
        {
          "action": "move_swords_dance",
          "avoidability": "avoidable",
          "branch": "setup follows a disrupted or threatened script; public punish can hit before setup converts"
        }
      ],
      "chosen_move_id": "move_sleep_powder",
      "chosen_score": 75,
      "confidence": 0.95,
      "current_win_conditions": [
        {
          "blockers": [
            "Snorlax"
          ],
          "next_step": "move_sleep_powder",
          "owner": "boss",
          "primary_piece": "Victreebel",
          "route_id": "sleep_control_vanilla_gsc_sleep_setup_disruption_001",
          "source": "public_state_inference"
        },
        {
          "blockers": [
            "Victreebel"
          ],
          "next_step": "Body Slam KOs or leaves Victreebel unable to set up if it spends the turn on Swords Dance.",
          "owner": "opponent",
          "primary_piece": "Snorlax",
          "route_id": "deny_opponent_sleep_control_vanilla_gsc_sleep_setup_disruption_001",
          "source": "public_opponent_model"
        }
      ],
      "decision_status": "action",
      "irreplaceable_pieces": [
        {
          "owner": "opponent",
          "piece": "Snorlax",
          "preserve": true,
          "role": "active route pressure or blocker",
          "source": "public_active_state"
        },
        {
          "owner": "boss",
          "piece": "Victreebel",
          "preserve": true,
          "role": "current action executor",
          "source": "public_active_state"
        }
      ],
      "mechanics_profile_seen": "vanilla_gsc",
      "policy_name": "state_transition_baseline_v1",
      "policy_version": "state_transition_baseline_v1",
      "rules_fired": [
        "chip is live but does not recreate the setup window",
        "public punish can hit before setup converts",
        "setup follows a disrupted or threatened script",
        "sleep is legal into an unstatused target",
        "sleep/setup disruption policy recreates the setup window"
      ],
      "state_hash": "sha256:6e3f88f0f46502e22b3820359e3ec07f4c6330a8ae22155967ba38b42c7ede21"
    },
    {
      "answer_changing_information": [
        {
          "field": "player_side_spikes_layers",
          "if_true": "different layer count can flip hazard, attack, or Explosion value",
          "needed": false
        }
      ],
      "benchmark_id": "romhack_spikes_third_layer_janine_001",
      "candidate_ranking": [
        {
          "action": "move_spikes",
          "move_class": "hazard",
          "rank": 1,
          "reason": "third local Spikes layer is live and hard to remove",
          "score": 80
        },
        {
          "action": "move_explosion",
          "move_class": "explosion",
          "rank": 2,
          "reason": "Explosion is a possible wall trade but competes with layer completion",
          "score": 30
        },
        {
          "action": "switch_tentacruel",
          "move_class": "switch",
          "rank": 3,
          "reason": "switching gives up the live third-layer turn",
          "score": -45
        }
      ],
      "candidate_scores": [
        {
          "class": "hazard",
          "move_id": "move_spikes",
          "reasons": [
            "third local Spikes layer is live and hard to remove"
          ],
          "score": 80
        },
        {
          "class": "explosion",
          "move_id": "move_explosion",
          "reasons": [
            "Explosion is a possible wall trade but competes with layer completion"
          ],
          "score": 30
        },
        {
          "class": "switch",
          "move_id": "switch_tentacruel",
          "reasons": [
            "switching gives up the live third-layer turn"
          ],
          "score": -45
        }
      ],
      "catastrophe_branches": [
        {
          "action": "switch_tentacruel",
          "avoidability": "review",
          "branch": "lowest-ranked visible branch: switching gives up the live third-layer turn"
        }
      ],
      "chosen_move_id": "move_spikes",
      "chosen_score": 80,
      "confidence": 0.95,
      "current_win_conditions": [
        {
          "blockers": [
            "Snorlax"
          ],
          "next_step": "move_spikes",
          "owner": "boss",
          "primary_piece": "Qwilfish",
          "route_id": "hazard_conversion_romhack_spikes_third_layer_janine_001",
          "source": "public_state_inference"
        },
        {
          "blockers": [
            "Qwilfish"
          ],
          "next_step": "Snorlax Body Slam chips but does not publicly stop Qwilfish from placing the layer.",
          "owner": "opponent",
          "primary_piece": "Snorlax",
          "route_id": "deny_opponent_hazard_conversion_romhack_spikes_third_layer_janine_001",
          "source": "public_opponent_model"
        }
      ],
      "decision_status": "action",
      "irreplaceable_pieces": [
        {
          "owner": "opponent",
          "piece": "Snorlax",
          "preserve": true,
          "role": "active route pressure or blocker",
          "source": "public_active_state"
        },
        {
          "owner": "boss",
          "piece": "Qwilfish",
          "preserve": true,
          "role": "current action executor",
          "source": "public_active_state"
        }
      ],
      "mechanics_profile_seen": "romhack_gym_leader_lab",
      "policy_name": "state_transition_baseline_v1",
      "policy_version": "state_transition_baseline_v1",
      "rules_fired": [
        "Explosion is a possible wall trade but competes with layer completion",
        "switching gives up the live third-layer turn",
        "third local Spikes layer is live and hard to remove"
      ],
      "state_hash": "sha256:54a4ada9cca0b06bf9cb92d29984513c833e0c5fa18c2f900240d9cf15155679"
    },
    {
      "answer_changing_information": [
        {
          "field": "player_side_spikes_layers",
          "if_true": "different layer count can flip hazard, attack, or Explosion value",
          "needed": false
        }
      ],
      "benchmark_id": "romhack_spikes_fourth_click_janine_001",
      "candidate_ranking": [
        {
          "action": "move_sludge_bomb",
          "move_class": "attack",
          "rank": 1,
          "reason": "live attack converts a complete hazard state",
          "score": 55
        },
        {
          "action": "move_explosion",
          "move_class": "explosion",
          "rank": 2,
          "reason": "Explosion remains live after the hazard stack is complete",
          "score": 35
        },
        {
          "action": "move_spikes",
          "move_class": "hazard",
          "rank": 3,
          "reason": "local Spikes are already maxed",
          "score": -100
        }
      ],
      "candidate_scores": [
        {
          "class": "attack",
          "move_id": "move_sludge_bomb",
          "reasons": [
            "live attack converts a complete hazard state"
          ],
          "score": 55
        },
        {
          "class": "explosion",
          "move_id": "move_explosion",
          "reasons": [
            "Explosion remains live after the hazard stack is complete"
          ],
          "score": 35
        },
        {
          "class": "hazard",
          "move_id": "move_spikes",
          "reasons": [
            "local Spikes are already maxed"
          ],
          "score": -100
        }
      ],
      "catastrophe_branches": [
        {
          "action": "move_spikes",
          "avoidability": "avoidable",
          "branch": "local Spikes are already maxed"
        }
      ],
      "chosen_move_id": "move_sludge_bomb",
      "chosen_score": 55,
      "confidence": 0.7,
      "current_win_conditions": [
        {
          "blockers": [
            "Snorlax"
          ],
          "next_step": "move_sludge_bomb",
          "owner": "boss",
          "primary_piece": "Qwilfish",
          "route_id": "hazard_conversion_romhack_spikes_fourth_click_janine_001",
          "source": "public_state_inference"